[
  {
    "id": "q1",
    "text": "What is the capital of France?",
    "options": ["London", "Paris", "Berlin", "Madrid"],
    "answerIndex": 1
  },
  {
    "id": "q2",
    "text": "Which planet is known as the Red Planet?",
    "options": ["Earth", "Mars", "Jupiter", "Saturn"],
    "answerIndex": 1
  },
  {
    "id": "q3",
    "text": "What is the largest ocean on Earth?",
    "options": ["Atlantic Ocean", "Indian Ocean", "Arctic Ocean", "Pacific Ocean"],
    "answerIndex": 3
  }
]
